[{"analysis_id":"EXOT-2024-32","collaboration":"ATLAS","data_period":"2022-2024","dataset_id":"ATLAS_Run3_2022_2024","experiment":"ATLAS","luminosity":{"definition":"integrated luminosity of analysis sample","unit":"fb^-1","value":"164"},"provenance":[{"locator":"S6.T2/observed:row6,col2;expected:row4,col2;zero_based","sha256":"6871595fe1a737fb5cdcc57f322626d870b24a7afc3060feb3ec4a9186c10444","source_id":"atlas_paper_v2","source_version":"2604.19495v2"},{"locator":"S1.p2.1","sha256":"6871595fe1a737fb5cdcc57f322626d870b24a7afc3060feb3ec4a9186c10444","source_id":"atlas_paper_v2","source_version":"2604.19495v2"},{"locator":"S3.p2.1","sha256":"6871595fe1a737fb5cdcc57f322626d870b24a7afc3060feb3ec4a9186c10444","source_id":"atlas_paper_v2","source_version":"2604.19495v2"}],"publication_date":"2026-09-24","purpose":"RESEARCH","schema_version":"1.0.0","sqrt_s":{"definition":"pp center-of-mass collision energy","unit":"TeV","value":"13.6"}},{"analysis_id":"EXO-24-028","collaboration":"CMS","data_period":"2016-2018","dataset_id":"CMS_Run2_2016_2018","experiment":"CMS","luminosity":{"definition":"integrated luminosity of analysis sample","unit":"fb^-1","value":"138"},"provenance":[{"locator":"Ch0.S3.p1.1","sha256":"7fadcfce5fce60055ccd817d98d05c9d09e4c759f1691022a0d3f4f7cf2be955","source_id":"cms_paper_v2","source_version":"2604.10732v2"},{"locator":"Ch0.S3.p2.1","sha256":"7fadcfce5fce60055ccd817d98d05c9d09e4c759f1691022a0d3f4f7cf2be955","source_id":"cms_paper_v2","source_version":"2604.10732v2"},{"locator":"Ch0.S3.p10.1","sha256":"7fadcfce5fce60055ccd817d98d05c9d09e4c759f1691022a0d3f4f7cf2be955","source_id":"cms_paper_v2","source_version":"2604.10732v2"},{"locator":"Ch0.S9.p2.1","sha256":"7fadcfce5fce60055ccd817d98d05c9d09e4c759f1691022a0d3f4f7cf2be955","source_id":"cms_paper_v2","source_version":"2604.10732v2"},{"locator":"Ch0.S9.SS2.p1.1","sha256":"7fadcfce5fce60055ccd817d98d05c9d09e4c759f1691022a0d3f4f7cf2be955","source_id":"cms_paper_v2","source_version":"2604.10732v2"},{"locator":"Ch0.S3.I1.i1.p1.1","sha256":"7fadcfce5fce60055ccd817d98d05c9d09e4c759f1691022a0d3f4f7cf2be955","source_id":"cms_paper_v2","source_version":"2604.10732v2"},{"locator":"Ch0.S3.p6.1","sha256":"7fadcfce5fce60055ccd817d98d05c9d09e4c759f1691022a0d3f4f7cf2be955","source_id":"cms_paper_v2","source_version":"2604.10732v2"},{"locator":"Ch0.S9.SS2.p2.1","sha256":"7fadcfce5fce60055ccd817d98d05c9d09e4c759f1691022a0d3f4f7cf2be955","source_id":"cms_paper_v2","source_version":"2604.10732v2"}],"publication_date":"2026-08-26","purpose":"RESEARCH","schema_version":"1.0.0","sqrt_s":{"definition":"pp center-of-mass collision energy","unit":"TeV","value":"13"}}]